name,address,rate,price,rank,suggested duration,description,attraction type,n_Excellent,n_VeryGood,n_Average,n_Poor,n_Terrible
Paddington Station,"Open Air Theatre Inner Circle Regents Park Regent's Park, London NW1 4NU England",4.0,0,111,N/A,"The award-winning Regent’s Park Open Air Theatre is a London landmark – a firm fixture of summer in the city, providing a cultural hub in the beautiful surroundings of a Royal Park. The wonderfully unpredictable nature of outdoor theatre makes each...","['Concerts & Shows', 'Theatres']",553,129,21,10,29
Hayman's Distillery,N/A,5.0,0,180,N/A,N/A,"['Concerts & Shows', 'Theatres']",727,251,73,31,37
ArcelorMittal Orbit,"next to her Kensington Palace home, London W2 3XA England",4.5,£11.50,130,3,"This seven-mile walkway in memory of Diana, Princess of Wales, winds its way through four of London's Royal parks, linking the palaces and mansions associated with her l","['Fun & Games', 'Nature & Parks', 'Playgrounds']",541,200,61,25,16
WWT London Wetland Centre,"3 Potters Field Park Potters Field, London SE1 2SG England",4.5,0,119,3,The Bridge is the first wholly new theatre of scale to be added to London’s commercial theatre sccene in 80 years. Now o,"['Concerts & Shows', 'Theatres']",184,67,19,9,7
Petrie Museum of Egyptian Archaeology,"100 London Road Forest Hill, London SE23 3PQ England",4.5,0,181,N/A,"The Horniman Museum and Gardens is an inspiring, surprising, family-friendly, free attraction in South London’s Forest Hill.The Museum has been open since Victorian times, when Frederick John Horniman first opened his house and extraordinary...","['Museums', 'Natural History Museums', 'Art Museums']",338,248,70,21,5
The Ginstitute,N/A,5.0,0,117,N/A,N/A,"['Sights & Landmarks', 'Points of Interest & Landmarks']",176,71,9,6,3
Victoria Palace Theatre,"Gracechurch Street, London EC3V 1LR England",4.5,0,334,N/A,"Leadenhall is a thriving Victorian covered retail centre with a wide range of goods on sale. Its cobbled walkways and glass roof make it an attractive place to shop, eat and drink or simply to relax. Famous visitors include John Wayne, Clint...","['Shopping', 'Flea & Street Markets']",256,338,112,16,5
Handel & Hendrix in London,N/A,4.0,£10.00,99,N/A,N/A,"['Concerts & Shows', 'Theatres']",467,149,28,16,21
Aldwych Theatre,"Chalk Farm Road, London NW1 8EH England",4.5,£80.00,186,3,"From modest Victorian beginnings – beginning life in 1846 as a steam-engine repair shed – to legendary cultural venue, the Roundhouse has an enviable heritage. The Grade II* listed building is a space dedicated to nurturing creative young talent, as...","['Concerts & Shows', 'Theatres']",277,128,29,10,18
Somerset House,"Kenwood House Hampstead Lane, London NW3 7JR England",4.5,0,170,N/A,"Set on the edge of Hampstead Heath and surrounded by tranquil landscaped gardens, Kenwood is one of London's hidden gems. The House, its breathtaking interiors and stunning art collection are free for everyone to enjoy. Discover the vast array of...","['Sights & Landmarks', 'Museums', 'Art Museums', 'Historic Sites', 'More']",510,233,43,16,22
Golden Hinde,"Regents Park Outer Circle, London NW1 4RY England",4.5,0,434,N/A,"ZSL London Zoo is packed full of wonder and amazement, with over 650 species of animals to meet and thousands more surprising and fascinating facts just waiting to be discovered. Find yourself face-to-face with our Asiatic lions and our friendly...","['Zoos & Aquariums', 'Nature & Parks', 'Outdoor Activities']",2416,2173,1305,634,435
King's Cross Station,N/A,4.0,0,269,N/A,N/A,"['Nature & Parks', 'Gardens']",68,10,3,1,0
Stamford Bridge,N/A,4.5,0,374,N/A,N/A,"['Sights & Landmarks', 'Other', 'Historic Walking Areas', 'Neighbourhoods', 'More']",668,1012,590,95,29
Green Park,"County Hall Westminster Bridge Road County Hall, London SE1 7PB England",4.5,0,472,3,"Dive in to an underwater world here at SEA LIFE London Aquarium, home to over 5,000 creatures. Explore London's flagship aquarium where you could learn something a-RAY-zing, spot a feeding frenzy or two and even meet some of our FIN-tastic frie","['Nature & Parks', 'Zoos & Aquariums']",1819,2110,1638,733,552
Little Venice,"31 Coventry Street Westminster, London W1D 6AS England",4.0,0,47,N/A,"Prince of Wales Theatre will run the mesmerizing London musical, Book of Mormon or Let It Be London musical tickets, which has already set the Broadway box office register ring","['Concerts & Shows', 'Theatres']",331,124,20,8,6
Broadway Market,N/A,4.5,0,230,N/A,N/A,"['Sights & Landmarks', 'Architectural Buildings']",357,166,82,27,22
Freud Museum,"South Bank, Waterloo, London SE1 9PX England",4.5,0,154,N/A,"This is a theatre that everyone can enjoy, from the classics and spectacular musicals to new plays and special events for the entire fam","['Concerts & Shows', 'Theatres']",785,203,62,26,20
Apsley House,"Horse Guards Whitehall, London SW1A 2AX England",4.5,0,183,N/A,"Situated at Horse Guards, Whitehall between Trafalgar Square and Westminster Abbey the Museum lies at the heart of historic London in magnificent mid 18th century vaulted stables. Dazzling displays of uniforms, weaponry and other prized exhibits...","['Museums', 'Speciality Museums']",208,178,55,8,4
Mayfair,N/A,4.5,0,298,N/A,N/A,"['Sights & Landmarks', 'Points of Interest & Landmarks']",154,245,81,9,2
The Charterhouse,London England,5.0,0,243,N/A,Major London thoroughfare known for its many shops offering luxurious apparel and fine consumer go,"['Sights & Landmarks', 'Points of Interest & Landmarks']",263,261,64,6,6
Regent's Canal,"Craven Cottage Stevenage Road Fulham, London SW6 6HH England",4.5,0,82,N/A,"Don't just watch Fulham's 2016/17 campaign, experience it from the comfort of one of our Match-day Hospitality packages. With 23 league fixtures to be played at Craven Cottage, don't miss out on enjoying the best views of the game, first-class...","['Sights & Landmarks', 'Fun & Games', 'Arenas & Stadiums', 'Sports Complexes', 'More']",264,92,18,3,6
Crystal Palace Park,"King's Road Duke of York's HQ, London SW3 4RY England",4.5,0,268,3,Contemporary art from unknown designers and artists from all over the w,"['Museums', 'Art Museums']",1017,506,151,53,56
Bank of England Museum,N/A,4.5,0,90,N/A,N/A,"['Sights & Landmarks', 'Scenic Walking Areas']",110,64,5,2,0
30 St Mary Axe (The Gherkin),N/A,4.5,0,199,N/A,N/A,"['Concerts & Shows', 'Theatres']",398,210,86,29,32
Kensington Palace,N/A,3.5,0,349,N/A,N/A,"['Other', 'Sights & Landmarks', 'Neighbourhoods', 'Points of Interest & Landmarks', 'More']",157,39,18,4,12
Barbican Centre,"20 Montford Place Kennington, London SE11 5DE England",4.0,0,242,2,"Beefeater London: The Home of Gin, the capital's first dedicated gin distillery , lifts the lid on the extraordinary stories and events behind one of the world's favourite spirits. Beefeater Gin, is the only historic dry gin still distilled in the...","['Food & Drink', 'Distilleries']",171,94,50,9,7
The Kia Oval,"Parliament Sqaure Elizabeth Tower - Houses of Parliament, Westminster, London SW1A 0AA England",4.5,£15.00,70,N/A,"This place is temporarily closed. Elizabeth Tower is the name of the famous clock tower which stands at the Houses of Parliament. The name Big Ben is often used to describe the tower, the clock and the bell but the name was first given to the Great...","['Sights & Landmarks', 'Points of Interest & Landmarks']",19663,7713,2818,841,756
South Kensington,"14 Gallery Road Dulwich Village, London SE21 7AD England",4.5,0,163,N/A,Dulwich Picture Gallery is the world’s first purpose-built public art gallery: it was founded in 1811 when Sir Francis Bourgeois RA bequeathed his collection of old masters “for the inspection of the public”. Today the Gallery is a vibrant cultural...,"['Museums', 'Shopping', 'Art Galleries', 'Art Museums', 'More']",262,150,33,11,4
Royal Courts of Justice,N/A,4.5,0,225,N/A,N/A,"['Concerts & Shows', 'Theatres']",782,347,115,37,42
City of London Distillery,"St. Paul's Churchyard The City, London EC4M 8BX England",4.5,0,43,N/A,"The City Information Centre is located in London's historic heart, the Square Mile - opposite St Paul's Cathedral . The multi-lingual staff are on hand to help any visitors with their questions and queries 7 days a week. It is your one-stop shop for...","['Traveller Resources', 'Visitor Centres']",91,28,1,0,1
Florence Nightingale Museum,"34 Haymarket, London SW1Y 4HA England",4.0,0,247,N/A,Fatal Attraction - The timeless thriller comes to the stage for the first time. Fatal Attraction is the new psychological thriller play at the Theatre Royal Haymarket based on the 1987 hit movie. The play is produced and directed by Sir Trevor Nunn...,"['Concerts & Shows', 'Theatres']",430,202,59,22,59
Royal Hospital Chelsea,"Romney Road Greenwich, London SE10 9NF England",4.5,0,176,N/A,"Serving as the Royal Residence, this historic house was commissioned by Queen Anne of Denmark, the wife of James I (reigned 1603-25), and now displays the National Maritime Museum's early art collection and sponsors special eve","['Sights & Landmarks', 'Museums', 'Architectural Buildings', 'Art Museums', 'More']",186,124,43,4,2
Brick Lane Music Hall,N/A,5.0,0,482,N/A,N/A,"['Events', 'Cultural Events']",1882,1726,887,392,434
Wimbledon,London England,4.5,0,121,N/A,"London's Broadway covers everything that smacks of theater and performance is here including concerts, sporting events, musicals and stage performan","['Other', 'Sights & Landmarks', 'Neighbourhoods']",361,172,29,12,11
Garden at 120,N/A,4.5,0,145,N/A,N/A,['Nature & Parks'],158,94,14,1,4
Madame Tussauds London,N/A,4.0,£29.00,204,N/A,N/A,"['Sights & Landmarks', 'Points of Interest & Landmarks']",106,121,27,4,2
Theatre Royal Drury Lane,N/A,4.5,0,378,N/A,N/A,"['Sights & Landmarks', 'Architectural Buildings', 'Points of Interest & Landmarks']",137,258,96,21,22
RHS Chelsea Flower Show,N/A,4.0,0,205,N/A,N/A,"['Sights & Landmarks', 'Other', 'Neighbourhoods']",71,69,15,1,0
Queen Mary's Gardens,N/A,4.5,0,88,N/A,N/A,"['Concerts & Shows', 'Theatres']",431,153,32,15,12
London Coliseum,N/A,4.5,0,511,N/A,N/A,"['Museums', 'Speciality Museums']",902,1032,742,288,231
Guildhall Art Gallery,"Olympic Stadium O Olympic Stadium Stratford Station, London E20 2ST England",4.5,0,317,N/A,"A new heart for east London, Queen Elizabeth Olympic Park is the city's newest park. It will be a new home to thousands and a new destination for millions. The Park is now open for the public to visit and is already coming alive as visitors explore...","['Sights & Landmarks', 'Nature & Parks', 'Points of Interest & Landmarks']",522,402,156,73,44
Hampstead,"1 Graces Alley, London E1 8JB England",4.5,0,95,2,"Wilton's is the world's oldest surviving Grand Music Hall. After years of dereliction it is now open as a full time theatre, bar and historic landmark. This stunning and atmospheric building puts on a range of ticketed events including theatre...","['Concerts & Shows', 'Theatres']",242,66,3,10,7
Regent's Park Open Air Theatre,"Seven Dials Covent Garden, London WC2 England",4.5,0,220,N/A,"Welcome to Seven Dials, the intriguing network of seven atmospheric streets that link Covent Garden to Soho. Always buzzy, packed with independent boutiques, international fashion labels, heritage brands, beauty salons, men’s grooming specialists...","['Sights & Landmarks', 'Other', 'Neighbourhoods']",104,92,23,2,0
Lyceum Theatre,"12 Holland Park Road Kensington, London W14 8LZ England",4.5,0,179,2,"*Please note that Leighton House Museum opens on Saturdays and Sundays only, from 10am to 5:30pm, due to a major restoration underway. The Museum will reopen in Spring 2021 * Leighton House Museum is the former home of the Victorian artist Frederic...","['Museums', 'Art Museums']",407,198,49,23,1
Diana Princess of Wales Memorial Playground,"12 Crooms Hill, London SE10 8ER England",4.5,0,142,N/A,"The UK's only Museum devoted to the history of fans and the craft of fan making. Nestled in the heart of historic Greenwich, The Fan Museum is home to a diverse collection of fans from around the world, dating from the 12th century to the present...","['Museums', 'Speciality Museums']",160,81,23,7,1
Bridge Theatre,N/A,4.5,0,299,N/A,N/A,"['Shopping', 'Shopping Malls']",108,198,43,2,3
Horniman Museum and Gardens,"Savoy Court Strand Strand, London WC2R 0ET England",4.5,0,219,N/A,Built by theatre impresario Richard D'Oyly Carte to showcase the work of Gilbert & Sullivan and famously the first public building in the world to be lit throughout by electricity. The Savoy Theatre is currently home to 9 to 5 - The Musi,"['Concerts & Shows', 'Theatres']",1359,403,139,67,90
Pop Brixton,London England,4.5,0,272,N/A,An attractive and quiet business and residential area of central Lon,"['Other', 'Sights & Landmarks', 'Neighbourhoods']",60,52,14,0,0
Leadenhall Market,London England,4.0,0,385,N/A,"Located between the districts of Chelsea and Belgravia, this square is synonymous with wealth and the very finest that money can ","['Other', 'Sights & Landmarks', 'Neighbourhoods']",60,64,21,3,3
Apollo Theatre,N/A,4.5,£65.00,278,N/A,N/A,"['Concerts & Shows', 'Theatres']",589,244,86,49,48
Roundhouse,"12 Stephenson Way, London NW1 2HD England",4.5,0,59,N/A,"The Magic Circle Headquarters is home to the world's premier magical society, The Magic Circle. It also houses a theatre, museum and entertainment space. We regularly hold events and open days for the public including History and Mystery at The...","['Concerts & Shows', 'Museums', 'Theatres', 'Speciality Museums', 'More']",229,33,7,2,4
Kenwood House,N/A,4.5,0,46,N/A,N/A,"['Food & Drink', 'Distilleries']",172,28,4,8,1
ZSL London Zoo,N/A,4.0,£25.20,428,N/A,N/A,"['Sights & Landmarks', 'Points of Interest & Landmarks']",268,266,213,83,43
Hill Garden & Pergola,"Peninsula Square, London SE10 0DX England",5.0,0,487,3,"The O2 is home to the world’s most popular music, sport, comedy and entertainment. Experience shopping at ICON Outlet; climb Up at The O2; enjoy cinema, trampolining and bowling and choose from over 30 bars and restaurants plus Mamma Mia! The Party...","['Sights & Landmarks', 'Arenas & Stadiums']",1879,1520,692,377,461
Chinatown,N/A,4.0,0,250,N/A,N/A,"['Shopping', 'Flea & Street Markets']",131,138,40,3,2
SEA LIFE London Aquarium,"Westminster Bridge Road Riverside Building, County Hall, London SE1 7PB England",3.5,£20.38,521,2,"Welcome to DreamWorks Tours: Shrek’s Adventure! London. A brilliantly bonkers interactive and immersive walkthrough experience, where the whole family can step into and star in your own hilarious misadventure with Shrek and his DreamWorks friends...","['Water & Amusement Parks', 'Theme Parks']",1179,1056,680,308,344
Prince of Wales Theatre,N/A,4.5,0,208,N/A,N/A,"['Sights & Landmarks', 'Points of Interest & Landmarks']",123,64,34,4,1
The Shard,N/A,4.0,0,168,N/A,N/A,"['Concerts & Shows', 'Theatres']",192,117,37,13,5
National Theatre,N/A,4.5,0,73,N/A,N/A,"['Museums', 'Speciality Museums']",147,53,6,2,0
The Household Cavalry Museum,"Exhibition Centre Warwick Road, London SW5 9TA England",4.5,£8.00,356,N/A,"Young and international area in London that offers a wide selection of restaurants, shops and p","['Sights & Landmarks', 'Other', 'Neighbourhoods']",77,85,38,7,4
Greenwich Foot Tunnel,"Coldharbour Lane Junction, London SW9 8PS England",4.0,0,191,2,"Brixton Village houses over 100 independent traders whose restaurants, boutiques, fruit and veg, meat, fish and massses of international food shops. This has created one of the most exciting places to visit in Lon","['Shopping', 'Flea & Street Markets']",118,76,8,4,2
Bond Street,"40 Brunswick Square, London WC1N 1AZ England",4.5,0,223,2,"The Foundling Museum explores the history of the Foundling Hospital, the UK’s first children’s charity and first public art gallery. Established in 1739 by philanthropist Thomas Coram, and continuing today as the children’s charity Coram, the...","['Museums', 'History Museums', 'Art Museums']",242,176,51,18,4
Craven Cottage,N/A,4.5,0,133,N/A,N/A,"['Concerts & Shows', 'Theatres']",568,167,35,25,25
Saatchi Gallery,N/A,4.5,0,124,N/A,N/A,"['Sights & Landmarks', 'Historic Sites', 'Architectural Buildings']",88,58,7,0,0
The Queen's Walk,N/A,4.5,0,152,N/A,N/A,"['Other', 'Sights & Landmarks', 'Neighbourhoods']",69,57,3,0,0
Piccadilly Theatre,"1 New Change, London EC4M 9AF England",4.0,£108.00,218,2,"One New Change is London’s newest shopping destination, complete with cafés and restaurants from renowned chefs and flagship menswear and womenswear fashion brands, all set overlooking London’s most famous landmark, St. Paul’s Cathedral. The...","['Shopping', 'Shopping Malls']",142,120,30,2,5
Hatton Garden,N/A,4.5,0,182,N/A,N/A,"['Sights & Landmarks', 'Nature & Parks', 'Gardens', 'Points of Interest & Landmarks', 'More']",82,69,13,0,0
Beefeater Gin Distillery,"2 Charing Cross Road, London WC2H 0HH England",4.0,0,194,N/A,"Rock of ages is created by Elliot Davis and James Bourne. Running at the Garrick Theatre, this show stars Aaron Sidwell as Michael, Eliza Hope Bennett as Holly, Stewart Clarke as Eddie, Charlotte Harwood as Leia, Richard Lowe as Lucas, Lil Chris as...","['Concerts & Shows', 'Theatres']",429,210,72,40,22
Big Ben,"Russell Square, London WC1B 5EH England",4.5,0,324,N/A,"Square located in Bloomsbury central London, with easy access to nearby attractions like the British Museum, Covent Garden and Oxford Street for shopp","['Sights & Landmarks', 'Points of Interest & Landmarks']",191,314,88,9,10
Dulwich Picture Gallery,N/A,4.5,0,331,N/A,N/A,"['Concerts & Shows', 'Theatres']",376,194,59,32,109
Apollo Victoria Theatre,N/A,4.5,0,105,N/A,N/A,"['Sights & Landmarks', 'Churches & Cathedrals', 'Architectural Buildings', 'Sacred & Religious Sites', 'Historic Sites', 'More']",164,57,11,2,7
City of London Information Centre,"Terminal 5 Departures, London Heathrow Airport, London TW6 2GA England",4.5,0,348,3,"In an ideal location overlooking the runway, Plaza Premium Lounge Terminal 5 Departures is the perfect setting for both business and leisure passengers. The luxurious space is open to all travellers and features an abundance of comfortable seating...","['Traveller Resources', 'Airport Lounges']",177,61,29,30,25
Haymarket Theatre Royal,N/A,4.0,£90.00,139,N/A,N/A,"['Concerts & Shows', 'Theatres']",529,145,41,12,32
Queen's House,N/A,4.5,0,351,N/A,N/A,['Nature & Parks'],79,30,3,1,3
Winter Wonderland,"Byward Street, London EC3R 5BJ England",4.0,0,109,N/A,"All Hallows By The Tower church (sometimes known historically as 'All Hallows Barking') was founded in 675 AD and, throughout London's history, has played a key part in almost every important event. A Roman pavement, Saxon stonework, Mediaeval...","['Museums', 'Sights & Landmarks', 'Speciality Museums', 'Churches & Cathedrals', 'More']",176,87,13,4,0
West End Theatre District,N/A,4.5,0,226,N/A,N/A,"['Concerts & Shows', 'Theatres']",141,72,22,11,11
Victoria Park,N/A,4.5,0,235,N/A,N/A,"['Sights & Landmarks', 'Historic Walking Areas', 'Points of Interest & Landmarks']",193,199,59,0,0
Whitehall,"Baker Street, London W1U England",4.5,0,375,N/A,"Baker Street is considered the center of England's punk movement, and whose name conjures images of Victorian England and the stories of Sherlock Hol","['Sights & Landmarks', 'Points of Interest & Landmarks']",122,183,96,16,8
London Victoria Station,N/A,4.0,0,233,N/A,N/A,"['Sights & Landmarks', 'Points of Interest & Landmarks']",229,237,68,2,1
Kensington,"Hyde Park Green Park, London W2 2UH England",4.5,0,53,N/A,"The RAF Benevolent Fund is proud and privileged to be the custodian of the new Bomber Command Memorial in central London. The memorial has been built to be modern, yet classical, in Portland stone. At its heart are the bronze sculptures of a Bomber...","['Sights & Landmarks', 'Monuments & Statues']",2094,513,121,12,14
Gielgud Theatre,N/A,4.5,0,293,N/A,N/A,"['Concerts & Shows', 'Theatres']",203,136,45,22,36
Sherlock Holmes Museum,"Cranbourn Street Leicester Square, London WC2H 7JH England",3.5,0,303,N/A,"The UK's largest and most popular casino. No membership, walk in freely, open 24/7, 6 bars, Pokerstars cash poker deck, award-winning Heliot Steak House, cabaret theatre, 2 smoking terraces & 3 floors of gambling. Great fun for gamblers and people...","['Casinos & Gambling', 'Fun & Games', 'Concerts & Shows', 'Cabarets', 'Theatres', 'More']",717,280,98,33,96
Queen Elizabeth Olympic Park,N/A,4.0,£11.50,203,N/A,N/A,"['Concerts & Shows', 'Theatres']",553,182,47,22,49
Wilton's Music Hall,N/A,4.5,0,352,N/A,N/A,"['Food & Drink', 'Shopping', 'Farmers Markets']",68,41,7,4,2
Seven Dials,"Olympic Stadium Loop Road Queen Elizabeth Olympic Park, Stratford, London E20 2ST England",4.5,0,403,N/A,"London Stadium (ex Olympic Stadium) is a superb multi-use venue to bring fans closer to music, sport and entertainment in a World Class environment. On non-event days, it offer Stadium Tours and hospitality for conferencing and eve","['Sights & Landmarks', 'Arenas & Stadiums']",982,397,165,98,77
Leighton House Museum,"Trafalgar Square, London England",4.5,0,274,N/A,"Ranked as one of London's greatest landmarks, this 185-foot high monument (circa 1843) looks down on the busy streets, fountains and swirling traffic of Trafalgar Squ","['Sights & Landmarks', 'Monuments & Statues', 'Points of Interest & Landmarks']",305,363,173,16,0
The Fan Museum,N/A,4.5,0,267,N/A,N/A,"['Museums', 'Observatories & Planetariums']",173,122,45,8,15
Hay's Galleria,"The Cut, SE1, London England",4.0,0,131,N/A,Victorian theater with a storied cast of famous performers including Laurence Olivier and Richard Bur,"['Concerts & Shows', 'Theatres']",474,176,37,22,20
Savoy Theatre,"11A Charing Cross Road, London WC2H 0EP England",4.5,0,527,N/A,"Used by more than 3 million visitors, The London Pass® is a complete sightseer credits package giving you access to over 80 of London's top attractions, museums and guided tours, saving you both time and money. Valid for 1-year from purchase date...",['Other'],416,271,170,146,151
Pimlico,N/A,4.5,0,319,N/A,N/A,"['Sights & Landmarks', 'Government Buildings']",84,37,12,4,2
Sloane Square,N/A,4.0,0,122,N/A,N/A,"['Sights & Landmarks', 'Architectural Buildings', 'Government Buildings']",163,82,21,3,2
Palace Theatre,"Rosebery Avenue, London EC1R 4TN England",4.5,0,62,N/A,London's Dance H,"['Concerts & Shows', 'Theatres']",359,117,29,7,5
The Magic Circle,N/A,4.5,0,196,N/A,N/A,"['Sights & Landmarks', 'Museums', 'Speciality Museums', 'Historic Sites', 'More']",91,63,13,3,1
Sipsmith Distillery,"Belvedere Road, London SE1 7PB England",4.5,0,221,N/A,"Situated in London’s stunning South Bank, the luxury 5-star Marriott County Hall Club & Spa is located on the top floors of this historic landmark building. The balcony areas offer breath-taking river views of Big Ben, The Houses of Parliament, and...","['Concerts & Shows', 'Sights & Landmarks', 'Architectural Buildings', 'Theatres', 'More']",88,43,14,4,2
Platform 9 3/4,London SW1H 0TL England,3.5,0,161,N/A,"One of the largest bus networks in the world, with around 8,500 vehicles in the fleet, 50 bus stations and 19,500 bus st","['Transportation', 'Mass Transportation Systems']",238,119,26,15,10
The O2,N/A,4.0,0,339,N/A,N/A,"['Sights & Landmarks', 'Fountains', 'Points of Interest & Landmarks']",303,253,128,51,19
Burlington Arcade,N/A,4.5,0,416,N/A,N/A,"['Museums', 'Speciality Museums']",284,277,166,108,72
DreamWork's Tours: Shrek's Adventure! London,N/A,3.5,£21.00,222,N/A,N/A,"['Sights & Landmarks', 'Monuments & Statues']",203,190,62,3,0
Tardis Police Box,"18 Folgate Street Liverpool Street Tube, London E1 6BX England",4.5,0,289,N/A,Dennis Severs' House offers a glimpse into 18th-century (Georgian-era) life in Engl,"['Museums', 'Speciality Museums']",381,191,84,40,30
St. Martins Theatre,"19 Great Eastern Street, London EC2A 3EJ England",4.5,0,229,N/A,"Dinerama is BACK and if you haven't made it down yet here's what you're missing - Six street diners, six bars, five street food shacks, two trucks, one DJ and a MILLION twinkling LEDs. Open for the rest of the summer four days a week every...","['Shopping', 'Flea & Street Markets']",223,148,22,13,10
Two Temple Place,"27 St. James's Place, London SW1A 1NR England",4.5,0,160,N/A,"Restored to the full splendor of its late eighteenth-century appearance, this manor house was once the residence of the Spencer family, whose famous member was Diana, Princess of Wa","['Sights & Landmarks', 'Architectural Buildings', 'Historic Sites']",107,26,10,2,1
Earl's Court,"49 City Road, London EC1Y 1AU England",4.0,0,135,N/A,The Museum of Methodism tells the history of Methodism from John Wesley to the present day and its contribution to shaping Britain's political and social history. John Wesley's House stands next to the Chapel. His home for over a decade it is one of...,"['Museums', 'Sights & Landmarks', 'Churches & Cathedrals', 'Speciality Museums', 'More']",90,34,5,1,0
Brixton Village,N/A,4.5,0,391,N/A,N/A,"['Sights & Landmarks', 'Points of Interest & Landmarks']",76,33,18,4,4
The Foundling Museum,N/A,4.5,0,177,N/A,N/A,"['Sights & Landmarks', 'Monuments & Statues']",115,74,31,2,1
Noel Coward Theatre,"12 Cable Street, London E1 8JG England",4.5,£59.72,364,2,"The museum at 12 Cable Street is a museum dedicated to the history of the East London in the 1880's, providing a serious examination of the crimes of Jack the Ripper within the social context of the period. For the first time it tells the story of...","['Museums', 'History Museums', 'Speciality Museums']",368,202,92,53,58
Guildhall,N/A,4.5,0,466,N/A,N/A,"['Sights & Landmarks', 'Sacred & Religious Sites', 'Points of Interest & Landmarks']",37,15,1,2,1
Southwark,"210 Shaftesbury Avenue, London WC2H 8DP England",4.5,0,282,N/A,Shaftesbury Theatre at the top of Shaftesbury Ave,"['Concerts & Shows', 'Theatres']",534,255,110,48,39
